{
 "format": "vial-web-lessons/1",
 "id": "ansi-60-en",
 "title": "ANSI 60 % QWERTY — English",
 "language": "en",
 "layout": {
  "name": "ANSI 60",
  "uid": "F00DFACEDEADBEEF",
  "hash": "sha256:895407b9cb17312f"
 },
 "generatedBy": {
  "tool": "claude-code",
  "model": "claude-fable-5-1",
  "at": "2026-10-22T13:30:00Z"
 },
 "notes": "Generated by the generate-lessons skill from the layout export of the test suite's ANSI 60 % US QWERTY board (scenario A of docs/learning/lesson-rules.md). Everything on layer 0 is taught; the board's layer 1 holds nothing typeable. The semicolon is a resting key and is drilled from lesson 1. Shifted number-row symbols come after the Numbers lesson, since they sit on the digit keys.",
 "lessons": [
  {
   "id": "01",
   "title": "New keys: Home row",
   "new": [
    {
     "char": "a",
     "key": "r2c1",
     "layer": 0,
     "via": "tap"
    },
    {
     "char": "s",
     "key": "r2c2",
     "layer": 0,
     "via": "tap"
    },
    {
     "char": "d",
     "key": "r2c3",
     "layer": 0,
     "via": "tap"
    },
    {
     "char": "f",
     "key": "r2c4",
     "layer": 0,
     "via": "tap"
    },
    {
     "char": "j",
     "key": "r2c7",
     "layer": 0,
     "via": "tap"
    },
    {
     "char": "k",
     "key": "r2c8",
     "layer": 0,
     "via": "tap"
    },
    {
     "char": "l",
     "key": "r2c9",
     "layer": 0,
     "via": "tap"
    },
    {
     "char": ";",
     "key": "r2c10",
     "layer": 0,
     "via": "tap"
    }
   ],
   "guidance": "Rest the left fingers on A S D F (pinky to index) and the right fingers on J K L ; (index to pinky); the bumps on F and J tell you where. The semicolon is the right pinky's resting key, so it is drilled here with the letters. Space is the thumb. Tap each key and come straight back.",
   "exercises": [
    {
     "id": "01-n1",
     "kind": "new-keys",
     "title": "New key exercise 1",
     "lines": [
      "ad ad jk jk sf sf k; k;",
      "as as kl kl df df j; j;",
      "fa fa lj lj ds ds ;k ;k",
      "asas jkjk dfdf l;l;",
      "sdsd klkl fjfj a;a;",
      "fads fads lads lads",
      "flak flak fall fall",
      "salk salk fjdk fjdk",
      "lass lass jaks jaks",
      "dak; dak; sljf sljf",
      "alfa alfa kdjs kdjs",
      "sadk sadk lfja lfja",
      "jdas jdas flak flak"
     ]
    },
    {
     "id": "01-n2",
     "kind": "new-keys",
     "title": "New key exercise 2",
     "lines": [
      "af af jl jl sd sd k; k;",
      "da da kj kj fs fs ;l ;l",
      "fafa klkl sdsd j;j;",
      "dada ljlj fsfs k;k;",
      "dads dads jall jall",
      "alas alas kdfs kdfs",
      "flak flak sala sala",
      "adds adds jlsk jlsk",
      "asks asks fjdl fjdl",
      "lass lass sakd sakd",
      "dask dask falj falj",
      ";lak ;lak dsfj dsfj",
      "lads lads kaf; kaf;"
     ]
    },
    {
     "id": "01-n3",
     "kind": "new-keys",
     "title": "New key exercise 3",
     "lines": [
      "sa sa lk lk fd fd ;j ;j",
      "ak ak sj sj dl dl f; f;",
      "akak sjsj dldl f;f;",
      "lala kdkd jaja sfsf",
      "fads fads skal skal",
      "lads lads jkfa jkfa",
      "fall fall dalk dalk",
      "salk salk adjl adjl",
      "fsa; fsa; lkjd lkjd",
      "dads dads lask lask",
      "flak flak sjda sjda",
      "asks asks l;fd l;fd",
      "alas alas kjfs kjfs"
     ]
    },
    {
     "id": "01-k1",
     "kind": "keys",
     "title": "Key exercise 1",
     "lines": [
      "ask ask asks asks",
      "add add adds adds",
      "ads ads all all",
      "dad dad dads dads",
      "fad fad fads fads",
      "lad lad lads lads",
      "sad sad lass lass",
      "salad salad salads salads",
      "flask flask flasks flasks",
      "flak flak fall fall",
      "falls falls"
     ]
    },
    {
     "id": "01-k2",
     "kind": "keys",
     "title": "Key exercise 2",
     "lines": [
      "alas alas alfalfa alfalfa",
      "salsa salsa salsas salsas",
      "ska ska dal dal",
      "dals dals dada dada",
      "sass sass skald skald",
      "lask lask fjad fjad",
      "sadk sadk jlfa jlfa",
      "dafk dafk slja slja",
      "kals kals fdsj fdsj",
      "aksl aksl jfda jfda",
      "jsad jsad lkfa lkfa"
     ]
    },
    {
     "id": "01-k3",
     "kind": "keys",
     "title": "Key exercise 3",
     "lines": [
      "fads fads jslk jslk",
      "lads lads kdfa kdfa",
      "flak flak sdjl sdjl",
      "fall fall ljks ljks",
      "lass lass fdak fdak",
      "dads dads kjls kjls",
      "asks asks dfla dfla",
      "adds adds ljdk ljdk",
      "dals dals saja saja",
      "sass sass kfdl kfdl",
      "alas alas jsfk jsfk",
      "dada dada lkaf lkaf",
      "salk salk dfjl dfjl"
     ]
    },
    {
     "id": "01-w1",
     "kind": "words",
     "title": "Word exercise",
     "lines": [
      "dal flasks lads lad dada asks",
      "all ads dads flask fads fall",
      "skald lass alfalfa ask alas sass",
      "dad sad falls salsa salad salads",
      "adds as add salsas ska dals",
      "flak fad flask ska flak as",
      "sass falls ask ads lad dads",
      "salad flasks alfalfa dada salads sad",
      "lass dals asks salsas dad fall",
      "fad fads alas salsa all dal",
      "lads skald add adds fads salsas",
      "salad lad dada asks all adds",
      "alfalfa alas lass sad salsa flask",
      "dals dad dads sass fad ska",
      "ask dal add skald falls as",
      "fall lads ads flasks flak salads"
     ]
    }
   ]
  },
  {
   "id": "02",
   "title": "New keys: e and i",
   "new": [
    {
     "char": "e",
     "key": "r1c3",
     "layer": 0,
     "via": "tap"
    },
    {
     "char": "i",
     "key": "r1c8",
     "layer": 0,
     "via": "tap"
    }
   ],
   "guidance": "E is the left middle finger, up one row from D. I is the right middle finger, up one row from K. Move only the finger; the hand stays on the home row.",
   "exercises": [
    {
     "id": "02-n1",
     "kind": "new-keys",
     "title": "New key exercise 1",
     "lines": [
      "seek seek idea idea",
      "feel feel like like",
      "else else lies lies",
      "deal deal dies dies",
      "file file idle idle",
      "seed seed aide aide",
      "life life keel keel",
      "flee flee skid skid",
      "leaf leaf jail jail",
      "feed feed isle isle",
      "desk desk eels eels",
      "ekes ekes dial dial",
      "lief lief fief fief"
     ]
    },
    {
     "id": "02-n2",
     "kind": "new-keys",
     "title": "New key exercise 2",
     "lines": [
      "aide aide fief fief",
      "idle idle leek leek",
      "lies lies elks elks",
      "dike dike eked eked",
      "isle isle lied lied",
      "seed seed skis skis",
      "lake lake flee flee",
      "eels eels sail sail",
      "like like silk silk",
      "deli deli keel keel",
      "dies dies feed feed",
      "side side flea flea",
      "idea idea self self"
     ]
    },
    {
     "id": "02-k1",
     "kind": "keys",
     "title": "Key exercise 1",
     "lines": [
      "asked asked field field",
      "slide slide ideas ideas",
      "files files kissed kissed",
      "ladies ladies faded faded",
      "desks desks skies skies",
      "sealed sealed likes likes",
      "lilies lilies jailed jailed",
      "failed failed idle idle",
      "seeds seeds elks elks",
      "isle isle fiddle fiddle",
      "saddle saddle easel easel"
     ]
    },
    {
     "id": "02-k2",
     "kind": "keys",
     "title": "Key exercise 2",
     "lines": [
      "aisle aisle flake flake",
      "sleek sleek silk silk",
      "deal deal leaf leaf",
      "lease lease seek seek",
      "feel feel fell fell",
      "filled filled skill skill",
      "skied skied sail sail",
      "jade jade self self",
      "dial dial disk disk",
      "kale kale died died",
      "lead lead flies flies"
     ]
    },
    {
     "id": "02-w1",
     "kind": "words",
     "title": "Word exercise 1",
     "lines": [
      "dale fad ask else eddies jails",
      "diesel laid kidded sales skis lie",
      "fed fissile alias flea idealised disliked",
      "fiefs ease kiddies salads lakes lidless",
      "silks lassies dikes eased lake sallies",
      "dials leads assailed idles salad ale",
      "dills seeded idealise lied eked fells",
      "flaked sells aliases see aisles kid",
      "adds selfless fake slid ideal alas",
      "eel fee sale keel skedaddled flee",
      "aids seal seas lid flail",
      "lass jades skiffle deli falsified",
      "deed eke flails skilled flakes"
     ]
    },
    {
     "id": "02-w2",
     "kind": "words",
     "title": "Word exercise 2",
     "lines": [
      "fail lad all kisses ill feed",
      "ekes dads liaises fakes eddied leased",
      "sidesaddle selfies sails diseased assess lifeless",
      "seeks lakeside fills idea lifelike keels",
      "alleles said dill dies fades filed",
      "dales assessed alike sidled deals allele",
      "deaf aided lies fade dislike sills",
      "dallied assail aside diesels saddled sad",
      "lessee aid side skids jelled jaded",
      "defies selfie dells ills kiss deeds",
      "die eels fill aide",
      "life dike dad idled",
      "flask fleas fielded seaside ladles"
     ]
    },
    {
     "id": "02-b1",
     "kind": "blind",
     "title": "Blind exercise 1",
     "lines": [
      "dailies jellied elk leak leaks skills",
      "ail leases skiffs flees sled eases",
      "lasses seedless like flasks sill add",
      "liaised ails slides ladle sleds jellies",
      "delis ideals ski seals feels fads",
      "sidle liked ladled liaise saddles seed",
      "sides file faked asks fillies skedaddle",
      "leafless allied fails fields lids flailed",
      "allies isles jail fief lassie felled",
      "addled sees sake led skid safes",
      "ailed falls kids elf sided easels"
     ]
    },
    {
     "id": "02-b2",
     "kind": "blind",
     "title": "Blind exercise 2",
     "lines": [
      "sailed daisies fiddled dislikes sea diseases",
      "sell feeds lads dialed dead lessees",
      "fled defied jiffies leaked sallied fall",